{"version":"v2.4.2","generated_at":"2025-08-24T14:26:18.086580+00:00","node_id":"api-1","build":{},"components":{"feature_flags":{"listen_notify":false,"moderation":false,"new_menu":false,"partner_fsm":false,"qr_webapp":false,"webapp_security":false},"webhooks":{"ui_refresh_menu":{"last_processed_ts":"2025-08-23T10:06:21+00:00","last_reason":"manual"}}}}